{
  "phaseId": "phase-5",
  "name": "Intelligence & Optimization",
  "status": "done",
  "owner": "Agent",
  "start": "2025-09-01T00:23:00Z",
  "completed": "2025-09-01T00:27:00Z",
  "updatedAt": "2025-09-01T00:27:00Z",
  "ciRunId": "local-run-0006",
  "evidenceFile": "development plan/.evidence/phase-5.json"
}
