{
  "phaseId": "phase-4",
  "name": "Seamless Integration (Level 3 Automation)",
  "status": "done",
  "owner": "Agent",
  "start": "2025-09-01T00:20:00Z",
  "completed": "2025-09-01T00:23:00Z",
  "updatedAt": "2025-09-01T00:23:00Z",
  "ciRunId": "local-run-0005",
  "evidenceFile": "development plan/.evidence/phase-4.json"
}
