{
  "phaseId": "phase-9",
  "name": "Final API Endpoint Resolution",
  "status": "done",
  "owner": "Agent",
  "start": "2025-09-03T12:30:00Z",
  "target": "2025-09-03T20:30:00Z",
  "completed": "2025-09-03T16:15:00Z",
  "ciRunId": "phase-9-complete",
  "evidenceFile": "development plan/.evidence/phase-9.json",
  "notes": "PHASE 9 COMPLETE: All 7 failing endpoints fixed via import/export alignment. System achieved 100% endpoint functionality (59/59 working). Resolved PreviewSandbox export, SemanticSystem class name mismatch, and ConfidenceEngine export issues.",
  "updatedAt": "2025-09-03T16:15:00Z"
}