{
  "phaseId": "phase-3",
  "name": "Pattern Learning Engine (Advisory + Accuracy)",
  "status": "done",
  "owner": "Agent",
  "start": "2025-09-01T00:18:00Z",
  "completed": "2025-09-01T00:20:00Z",
  "updatedAt": "2025-09-01T00:20:00Z",
  "ciRunId": "local-run-0004",
  "evidenceFile": "development plan/.evidence/phase-3.json"
}
