{
  "phaseId": "phase-7",
  "name": "Studio UI (Vite + React)",
  "status": "done",
  "owner": "Agent",
  "start": "2025-09-01T00:32:00Z",
  "completed": "2025-09-01T00:39:00Z",
  "updatedAt": "2025-09-01T00:39:00Z",
  "ciRunId": "local-run-0008",
  "evidenceFile": "development plan/.evidence/phase-7.json"
}
