{
  "phaseId": "phase-0",
  "name": "Intelligent Foundation",
  "status": "done",
  "owner": "Agent",
  "start": "2025-09-01T00:00:00Z",
  "completed": "2025-09-01T00:05:00Z",
  "updatedAt": "2025-09-01T00:05:00Z",
  "ciRunId": "local-run-0001",
  "evidenceFile": "development plan/.evidence/phase-0.json"
}
